[
  {
    "id": "meal_library_B1",
    "name": "Big Oat Jar with chia",
    "source": "library",
    "mealType": "breakfast",
    "ingredients": [
      {
        "foodId": "food_core_rolled_oats_dry",
        "quantity": 70,
        "unit": "g"
      },
      {
        "foodId": "food_core_cottage_cheese_2",
        "quantity": 175,
        "unit": "g"
      },
      {
        "foodId": "food_core_milk_2",
        "quantity": 100,
        "unit": "g"
      },
      {
        "foodId": "food_core_chia_seeds",
        "quantity": 10,
        "unit": "g"
      },
      {
        "foodId": "food_core_blueberries_frozen",
        "quantity": 75,
        "unit": "g"
      },
      {
        "foodId": "food_core_banana",
        "quantity": 100,
        "unit": "g"
      },
      {
        "foodId": "food_core_peanut_butter",
        "quantity": 8,
        "unit": "g"
      }
    ],
    "favorite": false,
    "metadata": {
      "legacyId": "B1",
      "lane": "jar",
      "nativeDayType": "lift",
      "weightDescription": "440 g jar + banana on the side",
      "prepMinutes": 5,
      "batchSize": 4,
      "base": "70 g dry oats + 10 g chia + banana",
      "steps": [
        "Stir oats, cottage cheese, milk and chia together in a 32 oz jar.",
        "Top with the blueberries and peanut butter. Do not stir them in.",
        "Fridge at least 8 hours — chia is still gritty at four. Banana eaten on the side in the car."
      ],
      "storage": "Batch four at once, keeps 4 days. Day four is noticeably stiffer — loosen with a splash of milk.",
      "notes": "Flax version: swap 10 g ground flax for the chia and drop peanut butter to 6 g. Use ground, never whole.",
      "ingredientLabels": {
        "food_core_rolled_oats_dry": "rolled oats",
        "food_core_blueberries_frozen": "blueberries"
      }
    }
  },
  {
    "id": "meal_library_B2",
    "name": "Protein Pancakes",
    "source": "library",
    "mealType": "breakfast",
    "ingredients": [
      {
        "foodId": "food_core_rolled_oats_dry",
        "quantity": 55,
        "unit": "g"
      },
      {
        "foodId": "food_core_cottage_cheese_2",
        "quantity": 120,
        "unit": "g"
      },
      {
        "foodId": "food_core_egg_whole",
        "quantity": 50,
        "unit": "g"
      },
      {
        "foodId": "food_core_protein_powder",
        "quantity": 10,
        "unit": "g"
      },
      {
        "foodId": "food_core_peanut_butter",
        "quantity": 10,
        "unit": "g"
      },
      {
        "foodId": "food_core_banana",
        "quantity": 110,
        "unit": "g"
      },
      {
        "foodId": "food_core_maple_syrup",
        "quantity": 25,
        "unit": "g"
      },
      {
        "foodId": "food_core_blueberries_frozen",
        "quantity": 75,
        "unit": "g"
      }
    ],
    "favorite": false,
    "metadata": {
      "legacyId": "B2",
      "lane": "griddle",
      "nativeDayType": "lift",
      "weightDescription": "~250 g plus toppings",
      "prepMinutes": 15,
      "batchSize": 1,
      "base": "55 g dry oats + banana",
      "steps": [
        "Blend oats, cottage cheese, egg and protein powder smooth, 45 seconds.",
        "Nonstick pan or griddle at medium, lightly greased. Quarter-cup pancakes, 2–3 min a side.",
        "Top with peanut butter, sliced banana, blueberries and the syrup."
      ],
      "storage": "Batter keeps 3 days blended. Cooked pancakes freeze and go straight into a toaster.",
      "notes": "Cook these Sunday and freeze them if they are for a Thursday or Friday — three days is the fridge limit.",
      "ingredientLabels": {
        "food_core_rolled_oats_dry": "rolled oats",
        "food_core_egg_whole": "egg",
        "food_core_blueberries_frozen": "blueberries"
      }
    }
  },
  {
    "id": "meal_library_B3",
    "name": "Greek Yogurt Bowl",
    "source": "library",
    "mealType": "breakfast",
    "ingredients": [
      {
        "foodId": "food_core_fage_0_greek_yogurt",
        "quantity": 200,
        "unit": "g"
      },
      {
        "foodId": "food_core_three_wishes_cereal",
        "quantity": 25,
        "unit": "g"
      },
      {
        "foodId": "food_core_one_degree_brown_rice_crisps",
        "quantity": 25,
        "unit": "g"
      },
      {
        "foodId": "food_core_blueberries_frozen",
        "quantity": 100,
        "unit": "g"
      },
      {
        "foodId": "food_core_banana",
        "quantity": 120,
        "unit": "g"
      },
      {
        "foodId": "food_core_peanut_butter",
        "quantity": 27,
        "unit": "g"
      },
      {
        "foodId": "food_core_honey",
        "quantity": 15,
        "unit": "g"
      }
    ],
    "favorite": false,
    "metadata": {
      "legacyId": "B3",
      "lane": "no cook",
      "nativeDayType": "lift",
      "weightDescription": "~560 g",
      "prepMinutes": 3,
      "batchSize": 1,
      "base": "25 g Three Wishes + 25 g rice crisps + banana",
      "steps": [
        "Yogurt into the bowl, cereal and fruit over.",
        "Peanut butter and honey last."
      ],
      "storage": "Assemble fresh — cereal goes soft within the hour.",
      "notes": "The 25 g of peanut butter and the full banana are what close this against slot. Weigh both; eyeballed, this bowl runs 7 g fat and 16 g carb short.",
      "ingredientLabels": {
        "food_core_fage_0_greek_yogurt": "greek yogurt nonfat",
        "food_core_blueberries_frozen": "blueberries"
      }
    }
  },
  {
    "id": "meal_library_B4",
    "name": "Banana-PB Overnight Oats",
    "source": "library",
    "mealType": "breakfast",
    "ingredients": [
      {
        "foodId": "food_core_rolled_oats_dry",
        "quantity": 70,
        "unit": "g"
      },
      {
        "foodId": "food_core_fage_0_greek_yogurt",
        "quantity": 170,
        "unit": "g"
      },
      {
        "foodId": "food_core_milk_2",
        "quantity": 100,
        "unit": "g"
      },
      {
        "foodId": "food_core_banana",
        "quantity": 130,
        "unit": "g"
      },
      {
        "foodId": "food_core_peanut_butter",
        "quantity": 20,
        "unit": "g"
      },
      {
        "foodId": "food_core_honey",
        "quantity": 10,
        "unit": "g"
      }
    ],
    "favorite": false,
    "metadata": {
      "legacyId": "B4",
      "lane": "jar",
      "nativeDayType": "lift",
      "weightDescription": "~470 g jar",
      "prepMinutes": 5,
      "batchSize": 3,
      "base": "70 g dry oats + banana",
      "steps": [
        "Mash half the banana into the oats, yogurt and milk.",
        "Slice the rest on top with the peanut butter and honey.",
        "Fridge at least 4 hours."
      ],
      "storage": "Four days in the jar is the outer limit and it stiffens by then. Build it two nights ahead, not on Sunday.",
      "notes": "Same jar format as B1, completely different texture — creamy rather than curdy. This is the cottage-cheese-fatigue option.",
      "ingredientLabels": {
        "food_core_rolled_oats_dry": "rolled oats",
        "food_core_fage_0_greek_yogurt": "greek yogurt nonfat"
      }
    }
  },
  {
    "id": "meal_library_B5",
    "name": "Freezer Breakfast Burrito",
    "source": "library",
    "mealType": "breakfast",
    "ingredients": [
      {
        "foodId": "food_core_tortilla_large_flour",
        "quantity": 72,
        "unit": "g"
      },
      {
        "foodId": "food_core_egg_whole",
        "quantity": 75,
        "unit": "g"
      },
      {
        "foodId": "food_core_potato_raw",
        "quantity": 170,
        "unit": "g"
      },
      {
        "foodId": "food_core_cheddar",
        "quantity": 10,
        "unit": "g"
      },
      {
        "foodId": "food_core_salsa",
        "quantity": 40,
        "unit": "g"
      },
      {
        "foodId": "food_core_fage_0_greek_yogurt",
        "quantity": 150,
        "unit": "g"
      },
      {
        "foodId": "food_core_banana",
        "quantity": 110,
        "unit": "g"
      }
    ],
    "favorite": false,
    "metadata": {
      "legacyId": "B5",
      "lane": "savoury · handheld",
      "nativeDayType": "lift",
      "weightDescription": "1 burrito + yogurt + banana",
      "prepMinutes": 45,
      "batchSize": 4,
      "base": "72 g tortilla + 170 g raw potato",
      "steps": [
        "Microwave the diced potato 7 min until just tender, then griddle over medium-high 8–10 min to crisp, seasoning with cumin, garlic powder, paprika and salt as it goes.",
        "Scramble the eggs soft and pull them 30 seconds early — they finish cooking on reheat.",
        "Warm the tortillas 15 seconds so they roll without cracking. Fill with potato, egg, cheddar, salsa. Roll tight, seam-side down, wrap individually in foil then a freezer bag.",
        "From frozen: unwrap the foil, 2 min in the microwave on a paper towel, or 8 min in the air fryer at 350 °F."
      ],
      "storage": "Freezer 2 months, fridge 4 days.",
      "notes": "Yogurt and banana on the side are part of the serving, not extras — the burrito alone is well short of slot.",
      "ingredientLabels": {
        "food_core_tortilla_large_flour": "flour tortilla",
        "food_core_egg_whole": "egg",
        "food_core_potato_raw": "potato",
        "food_core_fage_0_greek_yogurt": "greek yogurt nonfat"
      }
    }
  },
  {
    "id": "meal_library_B6",
    "name": "Blueberry Baked Oatmeal, 2 squares",
    "source": "library",
    "mealType": "breakfast",
    "ingredients": [
      {
        "foodId": "food_core_rolled_oats_dry",
        "quantity": 75,
        "unit": "g"
      },
      {
        "foodId": "food_core_egg_whole",
        "quantity": 25,
        "unit": "g"
      },
      {
        "foodId": "food_core_milk_2",
        "quantity": 75,
        "unit": "g"
      },
      {
        "foodId": "food_core_fage_0_greek_yogurt",
        "quantity": 110,
        "unit": "g"
      },
      {
        "foodId": "food_core_banana",
        "quantity": 65,